{
  "id": "WWYC8M2SRG1V",
  "chain": {
    "id": "995599",
    "ref": {
      "authCode": "K9YGM29YJJMA",
      "rrn": "LLFXG2Y5FQTX",
      "srn": "D02UTKZZFXSE"
    },
    "serviceType": "I7",
    "serviceTypeExtension": "731500-03",
    "serviceDateTime": "2022-08-26T10:35:41"
  },
  "actionType": "Presentment",
  "card": {
    "id": "1084687030",
    "externalId": "40914810200009000369",
    "pan": "529938******8812",
    "cardType": {
      "paymentScheme": "Mastercard",
      "memberId": "007703",
      "bin": "529938",
      "country": "RUS",
      "region": "Europe",
      "serviceCode": "101",
      "isChip": false,
      "isLocal": false,
      "psProduct": "MCS",
      "psCardBrand": "MCC",
      "psFundingSource": "Credit"
    },
    "plastic": {
      "expire": "2607",
      "seqvN": "1"
    },
    "client": {
      "id": "91667956",
      "externalId": "ClientNum681030",
      "clientCategory": "Private"
    }
  },
  "account": {
    "id": "1084687020",
    "iban": "40914810200009000369",
    "accountNumber": "40914810200009000369",
    "contractNumber": "9800-P-311661",
    "client": {
      "id": "91667956",
      "externalId": "ClientNum681030",
      "clientCategory": "Private"
    }
  },
  "requestedAmount": {
    "paymentDirection": "Debit",
    "transaction": {
      "amount": "4929.87000",
      "currency": "RUR"
    },
    "billing": {
      "amount": "2300.00",
      "currency": "RUR"
    }
  },
  "routing": {
    "direction": "Incoming",
    "routingType": "OnUs"
  },
  "pointOfService": {
    "terminalId": "11111111",
    "terminalType": "ECOMMERCE",
    "mcc": "6536",
    "institution": {
      "bank": "9800",
      "branch": "9800",
      "country": "RUS"
    }
  },
  "processing": {
    "billingDate": "2021-07-01",
    "availableAmount": {
      "amount": "19000.00",
      "currency": "RUR"
    },
    "baseAmount": {
      "amount": "2300.00",
      "currency": "USD"
    },
    "resolution": "Accepted",
    "resultCode": "SITV3FYHHXYX",
    "chainStage": "Authorized",
    "processedAt": "2022-08-26T07:35:41Z",
    "effectiveDate": "2022-08-26",
    "fxRateId": "371860000001"
  },
  "taggedData": {
    "PINR": "0",
    "TGTCC": "RUS",
    "PRODUCT_ID": "MCS",
    "APRPD_IND": "N",
    "CARD_AFS": "C",
    "CARD_PTI": "1",
    "SRCCC": "RUS",
    "T_USG": "AKR"
  }
}